name,price,created_at
Volkswagen et ipsa sit,14736,2023-02-20 06:40:48
Ford eos quaerat dignissimos,79235,2022-09-30 16:33:08
Suzuki assumenda magnam et,63630,2023-02-02 19:28:58
Audi id ullam dolore,190246,2022-11-05 03:59:36
Ford atque cupiditate delectus,169138,2022-08-02 11:44:33
Skoda laboriosam ipsa nemo,22000,2022-09-18 20:28:18
Audi sunt rerum minima,104538,2022-11-22 13:44:52
Nissan dolor mollitia incidunt,97706,2022-12-05 06:53:12
Mazda sit fugit id,121988,2022-05-18 10:26:45
RAM deleniti neque distinctio,112079,2022-09-16 00:15:48
Nissan eos deleniti quia,69684,2023-02-20 10:41:17
Ford quibusdam quo veniam,54701,2022-04-08 03:47:49
BMW ducimus culpa est,39130,2022-03-14 08:20:13
BMW tenetur autem sunt,113300,2023-02-01 09:09:41
Mazda dicta impedit sint,156059,2022-10-24 20:17:36
Nissan ea omnis dolor,170049,2022-06-24 06:18:22
Toyota voluptas cum optio,32536,2022-12-24 02:28:19
Suzuki molestiae incidunt excepturi,122464,2022-04-30 16:44:13
Volkswagen totam commodi temporibus,103910,2022-12-22 12:36:49
RAM exercitationem molestias adipisci,139711,2022-05-08 19:55:44
Renault quia cum reprehenderit,42234,2022-08-04 03:19:34
Audi itaque sequi odit,145637,2022-04-12 16:34:41
Volkswagen excepturi temporibus non,59359,2022-08-07 18:02:34
Honda et nesciunt tempore,144144,2022-03-14 16:25:10
Renault nobis rerum perferendis,14983,2023-01-18 06:02:35
Honda veniam ipsum tenetur,17015,2023-01-20 15:32:27
Jeep sed quia sit,155771,2022-05-19 16:34:28
Renault ex debitis nostrum,39543,2022-09-16 05:56:40
Mercedes delectus quas ex,31842,2022-05-06 22:51:19
Honda facilis qui rerum,194284,2022-12-02 16:19:18
Hyundai maiores eum quia,142693,2022-08-24 09:29:28
Renault nisi veniam modi,33717,2022-03-25 07:27:09
Ford qui in alias,181885,2022-08-14 06:15:26
Mazda fugiat dolor minima,122774,2023-01-16 23:15:47
Ford perspiciatis nisi tempore,186488,2022-07-08 19:00:00
Jeep possimus molestiae veritatis,95210,2022-07-22 20:39:03
Mazda suscipit et occaecati,161322,2022-07-07 15:04:10
BMW maxime enim aut,145776,2022-09-30 17:33:15
Nissan atque odio ex,11933,2023-01-17 16:31:53
Subaru sit repellendus fuga,157965,2022-12-17 07:44:08
Audi sunt labore omnis,159914,2022-05-01 11:39:15
Nissan eaque magnam ex,100984,2022-05-30 16:44:02
Nissan facilis praesentium dignissimos,81238,2022-06-17 12:52:53
Jeep delectus qui veritatis,23881,2023-01-11 07:17:32
Dacia deleniti voluptatem eligendi,111169,2022-04-25 05:07:33
Jeep magnam inventore ut,188421,2022-04-15 00:00:12
BMW sunt ipsam maiores,146544,2022-10-05 02:52:34
Jeep iusto eos distinctio,96727,2022-06-19 14:57:24
Mazda cupiditate inventore maiores,49515,2022-12-13 23:33:20
BMW natus ad ut,121516,2023-01-27 01:09:12
